{"schemaVersion":"castingcompass.water-quality-advisory/2.0.0","policyVersion":"castingcompass.water-quality-advisory/official-programs-0.4.0","policySha256":"3b5f51135c493e51f4f8ebb507ba73cb473f213cf6829ed3f916c32233a2e785","collectorSha256":"8545ad220cf5bd79acd2f0acbc7330052271b3451ab7468dde1a2ab7bf7d60e8","siteCatalogSha256":"a7145a66368c6dd5dd13b6bec421d430d228a3082d2fa8ad31941fc84e14078d","generatedAt":"2026-07-21T14:40:40Z","status":"partial","meaning":"human-health water-contact advisory overlay; never a catch-probability or seafood-safety signal","freshness":{"maximumSampleAgeDays":10},"scoreContribution":{"mode":"excluded-pending-frozen-baseline-validation","positiveContributionAllowed":false,"activeAgencyStatusSuppressesRecommendation":true},"sources":{"sfpuc":{"agency":"San Francisco Public Utilities Commission","programUrl":"https://www.sfpuc.gov/programs/ocean-and-beach-monitoring","statusUrl":"https://webapps.sfpuc.org/sapps/beachesandbay.html","machineUrl":"https://infrastructure.sfwater.org/lims.asmx/getBeaches","absenceBehavior":"neutral-only-with-current-complete-samples","errorCategory":null},"california-beachwatch-santa-barbara":{"agency":"California State Water Resources Control Board","programUrl":"https://www.waterboards.ca.gov/water_issues/programs/beaches/beach_surveys/index.html","statusUrl":"https://beachwatch.waterboards.ca.gov/public/advisory.php","machineUrl":"https://beachwatch.waterboards.ca.gov/public/advisory.php","absenceBehavior":"unknown","errorCategory":null},"california-beachwatch-marin":{"agency":"California State Water Resources Control Board","programUrl":"https://www.waterboards.ca.gov/water_issues/programs/beaches/beach_surveys/index.html","statusUrl":"https://beachwatch.waterboards.ca.gov/public/advisory.php","machineUrl":"https://beachwatch.waterboards.ca.gov/public/advisory.php","absenceBehavior":"unknown","errorCategory":null},"san-mateo-county-health":{"agency":"San Mateo County Health","programUrl":"https://www.smchealth.org/node/1201","statusUrl":"https://www.smchealth.org/node/1201","machineUrl":"https://www.smchealth.org/node/1201","absenceBehavior":"unknown","errorCategory":null}},"sites":{"alameda-south-shore-rockwall":{"sourceId":null,"stationIds":[],"stationNames":[],"checkedAt":"2026-07-21T14:40:40Z","sampleDates":[],"actionStartDates":[],"actionEndDates":[],"scoreDelta":null,"sourceUrl":"https://www.waterboards.ca.gov/water_issues/programs/beaches/beach_water_quality/","status":"not-covered","recommendationEffect":"unknown","officialLabel":"No exact official station mapped","detail":"CastingCompass has no exact, reviewed official water-quality station mapping for this site."},"albany-bulb":{"sourceId":null,"stationIds":[],"stationNames":[],"checkedAt":"2026-07-21T14:40:40Z","sampleDates":[],"actionStartDates":[],"actionEndDates":[],"scoreDelta":null,"sourceUrl":"https://www.waterboards.ca.gov/water_issues/programs/beaches/beach_water_quality/","status":"not-covered","recommendationEffect":"unknown","officialLabel":"No exact official station mapped","detail":"CastingCompass has no exact, reviewed official water-quality station mapping for this site."},"arroyo-burro-beach":{"sourceId":"california-beachwatch-santa-barbara","stationIds":["WP0000147","All_Santa_Barbara_County_Beaches"],"stationNames":[],"checkedAt":"2026-07-21T14:40:40Z","sampleDates":[],"actionStartDates":[],"actionEndDates":[],"scoreDelta":null,"sourceUrl":"https://beachwatch.waterboards.ca.gov/public/advisory.php","status":"unknown","recommendationEffect":"unknown","officialLabel":"No active action verified","detail":"No active action was found in this official table. Because absence does not prove a current no-posting status, this site remains unknown."},"baker-beach":{"sourceId":"sfpuc","stationIds":["4608","4609","4610"],"stationNames":["Baker Beach West","Baker Beach East","Baker Beach at Lobos Creek"],"checkedAt":"2026-07-21T14:40:40Z","sampleDates":["2026-07-13"],"actionStartDates":[],"actionEndDates":[],"scoreDelta":null,"sourceUrl":"https://webapps.sfpuc.org/sapps/beachesandbay.html","status":"no-active-posting","recommendationEffect":"neutral","officialLabel":"No active posting reported","detail":"Neutral context only. This does not mean the water or seafood is safe and does not improve the fishing score."},"berkeley-marina-north-basin":{"sourceId":null,"stationIds":[],"stationNames":[],"checkedAt":"2026-07-21T14:40:40Z","sampleDates":[],"actionStartDates":[],"actionEndDates":[],"scoreDelta":null,"sourceUrl":"https://www.waterboards.ca.gov/water_issues/programs/beaches/beach_water_quality/","status":"not-covered","recommendationEffect":"unknown","officialLabel":"No exact official station mapped","detail":"CastingCompass has no exact, reviewed official water-quality station mapping for this site."},"bolinas-beach":{"sourceId":"california-beachwatch-marin","stationIds":["BOLINAS"],"stationNames":["Bolinas Beach"],"checkedAt":"2026-07-21T14:40:40Z","sampleDates":[],"actionStartDates":["2026-07-15"],"actionEndDates":[],"scoreDelta":null,"sourceUrl":"https://beachwatch.waterboards.ca.gov/public/advisory.php","status":"posted","recommendationEffect":"suppress","officialLabel":"Official water-contact posting","detail":"A current county-submitted action in the official State Board table suppresses this site from recommendations."},"carpinteria-state-beach":{"sourceId":"california-beachwatch-santa-barbara","stationIds":["WP0000180","All_Santa_Barbara_County_Beaches"],"stationNames":[],"checkedAt":"2026-07-21T14:40:40Z","sampleDates":[],"actionStartDates":[],"actionEndDates":[],"scoreDelta":null,"sourceUrl":"https://beachwatch.waterboards.ca.gov/public/advisory.php","status":"unknown","recommendationEffect":"unknown","officialLabel":"No active action verified","detail":"No active action was found in this official table. Because absence does not prove a current no-posting status, this site remains unknown."},"cesar-chavez-park":{"sourceId":null,"stationIds":[],"stationNames":[],"checkedAt":"2026-07-21T14:40:40Z","sampleDates":[],"actionStartDates":[],"actionEndDates":[],"scoreDelta":null,"sourceUrl":"https://www.waterboards.ca.gov/water_issues/programs/beaches/beach_water_quality/","status":"not-covered","recommendationEffect":"unknown","officialLabel":"No exact official station mapped","detail":"CastingCompass has no exact, reviewed official water-quality station mapping for this site."},"china-beach":{"sourceId":"sfpuc","stationIds":["4607"],"stationNames":["China Beach"],"checkedAt":"2026-07-21T14:40:40Z","sampleDates":["2026-07-13"],"actionStartDates":[],"actionEndDates":[],"scoreDelta":null,"sourceUrl":"https://webapps.sfpuc.org/sapps/beachesandbay.html","status":"no-active-posting","recommendationEffect":"neutral","officialLabel":"No active posting reported","detail":"Neutral context only. This does not mean the water or seafood is safe and does not improve the fishing score."},"coyote-point-jetty":{"sourceId":"san-mateo-county-health","stationIds":["AB18762"],"stationNames":[],"checkedAt":"2026-07-21T14:40:40Z","sampleDates":[],"actionStartDates":[],"actionEndDates":[],"scoreDelta":null,"sourceUrl":"https://www.smchealth.org/node/1201","status":"unknown","recommendationEffect":"unknown","officialLabel":"No current county posting verified","detail":"No exact mapped station appeared in the current County Health posting list. Because unlisted or unsampled status does not prove no posting, this site remains unknown."},"crane-cove-park":{"sourceId":"sfpuc","stationIds":["4620"],"stationNames":["Crane Cove Park"],"checkedAt":"2026-07-21T14:40:40Z","sampleDates":["2026-07-13"],"actionStartDates":[],"actionEndDates":[],"scoreDelta":null,"sourceUrl":"https://webapps.sfpuc.org/sapps/beachesandbay.html","status":"no-active-posting","recommendationEffect":"neutral","officialLabel":"No active posting reported","detail":"Neutral context only. This does not mean the water or seafood is safe and does not improve the fishing score."},"crissy-field-east-beach":{"sourceId":"sfpuc","stationIds":["4612"],"stationNames":["Crissy Field Beach East"],"checkedAt":"2026-07-21T14:40:40Z","sampleDates":["2026-07-13"],"actionStartDates":[],"actionEndDates":[],"scoreDelta":null,"sourceUrl":"https://webapps.sfpuc.org/sapps/beachesandbay.html","status":"no-active-posting","recommendationEffect":"neutral","officialLabel":"No active posting reported","detail":"Neutral context only. This does not mean the water or seafood is safe and does not improve the fishing score."},"crown-memorial-state-beach":{"sourceId":null,"stationIds":[],"stationNames":[],"checkedAt":"2026-07-21T14:40:40Z","sampleDates":[],"actionStartDates":[],"actionEndDates":[],"scoreDelta":null,"sourceUrl":"https://www.waterboards.ca.gov/water_issues/programs/beaches/beach_water_quality/","status":"not-covered","recommendationEffect":"unknown","officialLabel":"No exact official station mapped","detail":"CastingCompass has no exact, reviewed official water-quality station mapping for this site."},"drakes-beach":{"sourceId":"california-beachwatch-marin","stationIds":["DRAKES BEACH","All_Marin_County_Beaches"],"stationNames":[],"checkedAt":"2026-07-21T14:40:40Z","sampleDates":[],"actionStartDates":[],"actionEndDates":[],"scoreDelta":null,"sourceUrl":"https://beachwatch.waterboards.ca.gov/public/advisory.php","status":"unknown","recommendationEffect":"unknown","officialLabel":"No active action verified","detail":"No active action was found in this official table. Because absence does not prove a current no-posting status, this site remains unknown."},"dumbarton-pier":{"sourceId":null,"stationIds":[],"stationNames":[],"checkedAt":"2026-07-21T14:40:40Z","sampleDates":[],"actionStartDates":[],"actionEndDates":[],"scoreDelta":null,"sourceUrl":"https://www.waterboards.ca.gov/water_issues/programs/beaches/beach_water_quality/","status":"not-covered","recommendationEffect":"unknown","officialLabel":"No exact official station mapped","detail":"CastingCompass has n